Question,Answer,Hint,Explanation,Key concept,Source,Starred
What percentage of the exam questions does planning and managing an Azure AI solution account for?,15-20%,It's the first topic covered in the exam.,"The planning and management of an Azure AI solution is a significant part of the AI-102 exam, comprising 15-20% of the questions.",Skills Measured,1,No
What is the focus of the AI-102 exam's first skills group?,Plan and manage an Azure AI solution.,It's the initial topic discussed in the exam preparation.,The first skills group introduces the foundational concepts necessary for successfully planning and managing Azure AI solutions.,Skills Measured,1,No
What are the five main topics covered in the AI-102 exam?,"1) Plan and manage an Azure AI solution, 2) Implement decision-support solutions, 3) Implement Azure AI vision solutions, 4) Implement natural language processing solutions, 5) Implement knowledge mining and document intelligence solutions.",Think about the various applications of AI in Azure.,These topics encompass a broad range of skills necessary for working with Azure AI solutions and are essential for the exam.,Skills Measured,1,No
What is the second main topic in the AI-102 exam skills measured?,Implement decision-support solutions.,It's about helping users make informed decisions.,Decision-support solutions are critical for enabling users to analyze data and make informed decisions using AI.,Skills Measured,1,No
What is the third main topic in the AI-102 exam skills measured?,Implement Azure AI vision solutions.,Focuses on visual data processing.,Azure AI vision solutions involve the use of AI to process and analyze images and video data.,Skills Measured,1,No
What is the fourth main topic in the AI-102 exam skills measured?,Implement natural language processing solutions.,It deals with understanding and generating human language.,"Natural language processing solutions are essential for applications that require interaction with human language, such as chatbots and text analysis.",Skills Measured,1,No
What is the fifth main topic in the AI-102 exam skills measured?,Implement knowledge mining and document intelligence solutions.,Focuses on extracting insights from documents.,Knowledge mining and document intelligence solutions help organizations extract valuable insights from unstructured data sources.,Skills Measured,1,No
What is the last main topic in the AI-102 exam skills measured?,Implement generative AI solutions.,Involves creating new content using AI.,"Generative AI solutions focus on using AI to create new content, such as images, text, and music, based on learned data.",Skills Measured,1,No
What is the first objective in the AI-102 exam preparation?,Select the appropriate Azure AI Service.,Choosing the right service is crucial for success.,Selecting the appropriate Azure AI service is fundamental for effectively implementing AI solutions tailored to specific needs.,Chapters,1,No
What is the second objective in the AI-102 exam preparation?,"Plan, create, and deploy an AI Service.",Involves the entire lifecycle of AI service management.,"Planning, creating, and deploying an AI service encompasses all stages of service management, ensuring successful implementation.",Chapters,1,No
What is the third objective in the AI-102 exam preparation?,"Manage, monitor, and secure an Azure AI Service.",Focuses on ongoing service administration.,"Managing, monitoring, and securing an Azure AI service is essential for maintaining its performance and security throughout its lifecycle.",Chapters,1,No
What is the fourth objective in the AI-102 exam preparation?,Implement AI solutions responsibly.,Ethics in AI is crucial.,Implementing AI solutions responsibly involves considering ethical implications and ensuring compliance with regulations and best practices.,Chapters,1,No